{"action_commitment":"dddddddddddddddddddddddddddddddddddddddddddddddddddddddddddddddd","agent_ref":"eip155:84532:erc8004:agent-42","assertions":[{"evidence_hash":"ffffffffffffffffffffffffffffffffffffffffffffffffffffffffffffffff","proof_mode":"commitment","result":"pass","rule_hash":"eeeeeeeeeeeeeeeeeeeeeeeeeeeeeeeeeeeeeeeeeeeeeeeeeeeeeeeeeeeeeeee","rule_id":"reconciliation-match"}],"input_commitment":"cccccccccccccccccccccccccccccccccccccccccccccccccccccccccccccccc","method_hash":"aaaaaaaaaaaaaaaaaaaaaaaaaaaaaaaaaaaaaaaaaaaaaaaaaaaaaaaaaaaaaaaa","occurred_at":"2026-08-08T10:00:02.000Z","outcome":"matched","phase":"reconciliation","policy_hash":"bbbbbbbbbbbbbbbbbbbbbbbbbbbbbbbbbbbbbbbbbbbbbbbbbbbbbbbbbbbbbbbb","previous_receipt_hash":"3e73c5b454a60686e7c72f9bbe8803b85c253c176d5e114e66e4a2d0afd85da1","receipt_id":"receipt_reconciliation_integrity_20260808","run_id":"run_pomrx_integrity_20260808","schema_version":"pom-rx/0.1","source_key_id":"pom-rx-integrity-key","subject_ref":"market:BTC-USD"}