{"action_commitment":"dddddddddddddddddddddddddddddddddddddddddddddddddddddddddddddddd","agent_ref":"eip155:84532:erc8004:agent-42","assertions":[{"evidence_hash":"ffffffffffffffffffffffffffffffffffffffffffffffffffffffffffffffff","proof_mode":"commitment","result":"pass","rule_hash":"eeeeeeeeeeeeeeeeeeeeeeeeeeeeeeeeeeeeeeeeeeeeeeeeeeeeeeeeeeeeeeee","rule_id":"preflight-policy"}],"input_commitment":"cccccccccccccccccccccccccccccccccccccccccccccccccccccccccccccccc","method_hash":"aaaaaaaaaaaaaaaaaaaaaaaaaaaaaaaaaaaaaaaaaaaaaaaaaaaaaaaaaaaaaaaa","occurred_at":"2026-08-08T10:00:00.000Z","outcome":"allow","phase":"preflight","policy_hash":"bbbbbbbbbbbbbbbbbbbbbbbbbbbbbbbbbbbbbbbbbbbbbbbbbbbbbbbbbbbbbbbb","previous_receipt_hash":null,"receipt_id":"receipt_preflight_integrity_20260808","run_id":"run_pomrx_integrity_20260808","schema_version":"pom-rx/0.1","source_key_id":"pom-rx-integrity-key","subject_ref":"market:BTC-USD"}